{
  "schema_version": 1,
  "generated_at": "2026-03-30T16:45:00Z",
  "lesser_host": {
    "base_url": "https://lab.lesser.host",
    "instance_slug": "simulacrum"
  },
  "requested_release": {
    "lesser_version": "v1.2.6",
    "lesser_body_version": "v1.0.8",
    "run_lesser": true,
    "run_lesser_body": true,
    "run_mcp": true
  },
  "checks": [
    {
      "id": "lesser_body_version_selected",
      "status": "pass",
      "detail": "requested lesser-body release v1.0.8 will be validated for managed certification"
    },
    {
      "id": "lesser_body_compatibility_contract_valid",
      "status": "pass",
      "detail": "requested lesser-body release matches the published lesser-host managed compatibility contract"
    },
    {
      "id": "lesser_body_template_preflight_valid",
      "status": "pass",
      "detail": "published template lesser-body-managed-dev.template.json passed lesser-host managed body template preflight"
    },
    {
      "id": "lesser_body_template_changeset_valid",
      "status": "pass",
      "detail": "published template lesser-body-managed-dev.template.json passed cloudformation_deploy_no_execute_changeset and is recorded at managed/updates/simulacrum/job-body-1/body-template-certification.json"
    },
    {
      "id": "lesser_body_completed",
      "status": "pass",
      "detail": "lesser-body managed phase completed successfully"
    },
    {
      "id": "lesser_body_runner_visibility_present",
      "status": "pass",
      "detail": "https://console.aws.amazon.com/codebuild/home?#/builds/job-body-1-body/view/new"
    },
    {
      "id": "lesser_body_receipt_key_defined",
      "status": "pass",
      "detail": "managed/updates/simulacrum/job-body-1/body-state.json"
    }
  ],
  "job": {
    "kind": "lesser-body",
    "job_id": "job-body-1",
    "status": "ok",
    "step": "done",
    "note": "lesser-body updated",
    "run_url": "https://console.aws.amazon.com/codebuild/home?#/builds/job-body-1-body/view/new",
    "body_run_url": "https://console.aws.amazon.com/codebuild/home?#/builds/job-body-1-body/view/new",
    "receipt_key": "managed/updates/simulacrum/job-body-1/body-state.json",
    "requested_version": "v1.0.8",
    "template_path": "lesser-body-managed-dev.template.json",
    "template_certification_key": "managed/updates/simulacrum/job-body-1/body-template-certification.json",
    "template_verification_mode": "cloudformation_deploy_no_execute_changeset"
  },
  "overall_status": "pass"
}
